02:52:22.484409 IP 192.168.3.131.57011 > 72.14.213.138.80: Flags [P.], seq 2542412440:2542413383, ack 2428019935, win 16288, length 943: HTTP: GET /complete/search?client=chrome&hl=en-US&q=cr HTTP/1.1
02:52:22.514250 IP 72.14.213.138.80 > 192.168.3.131.57011: Flags [P.], seq 1:387, ack 943, win 947, length 386: HTTP: HTTP/1.1 200 OK
02:52:22.708292 IP 192.168.3.131.55950 > 72.14.213.102.80: Flags [S], seq 1562033828, win 8192, options [mss 1460,nop,wscale 2,nop,nop,sackOK], length 0
02:52:22.713832 IP 192.168.3.131.57011 > 72.14.213.138.80: Flags [.], ack 387, win 16192, length 0
02:52:22.727058 IP 72.14.213.102.80 > 192.168.3.131.55950: Flags [S.], seq 2992713107, ack 1562033829, win 5720, options [mss 1430,nop,nop,sackOK,nop,wscale 6], length 0
02:52:22.727105 IP 192.168.3.131.55950 > 72.14.213.102.80: Flags [.], ack 1, win 16445, length 0
02:52:22.727459 IP 192.168.3.131.55950 > 72.14.213.102.80: Flags [P.], seq 1:945, ack 1, win 16445, length 944: HTTP: GET /complete/search?client=chrome&hl=en-US&q=msn HTTP/1.1
02:52:22.747390 IP 192.168.3.131.55950 > 72.14.213.102.80: Flags [F.], seq 945, ack 1, win 16445, length 0
02:52:22.748483 IP 72.14.213.102.80 > 192.168.3.131.55950: Flags [.], ack 945, win 119, length 0
02:52:22.761080 IP 72.14.213.102.80 > 192.168.3.131.55950: Flags [P.], seq 1:488, ack 945, win 119, length 487: HTTP: HTTP/1.1 200 OK
02:52:22.761168 IP 192.168.3.131.55950 > 72.14.213.102.80: Flags [R.], seq 946, ack 488, win 0, length 0
02:52:22.766777 IP 72.14.213.102.80 > 192.168.3.131.55950: Flags [F.], seq 488, ack 946, win 119, length 0
02:52:22.928128 IP 192.168.3.131.52152 > 72.14.213.147.443: Flags [S], seq 416920696, win 8192, options [mss 1460,nop,wscale 2,nop,nop,sackOK], length 0
02:52:22.946723 IP 72.14.213.147.443 > 192.168.3.131.52152: Flags [S.], seq 4005169627, ack 416920697, win 5720, options [mss 1430,nop,nop,sackOK,nop,wscale 6], length 0
02:52:22.946812 IP 192.168.3.131.52152 > 72.14.213.147.443: Flags [.], ack 1, win 16445, length 0
02:52:22.947575 IP 192.168.3.131.52152 > 72.14.213.147.443: Flags [P.], seq 1:178, ack 1, win 16445, length 177
02:52:22.966283 IP 72.14.213.147.443 > 192.168.3.131.52152: Flags [.], ack 178, win 107, length 0
02:52:22.967705 IP 72.14.213.147.443 > 192.168.3.131.52152: Flags [.], seq 1:1431, ack 178, win 107, length 1430
02:52:22.968530 IP 72.14.213.147.443 > 192.168.3.131.52152: Flags [P.], seq 1431:1722, ack 178, win 107, length 291
02:52:22.968559 IP 192.168.3.131.52152 > 72.14.213.147.443: Flags [.], ack 1722, win 16445, length 0
02:52:22.972193 IP 192.168.3.131.52152 > 72.14.213.147.443: Flags [P.], seq 178:453, ack 1722, win 16445, length 275
02:52:22.993256 IP 72.14.213.147.443 > 192.168.3.131.52152: Flags [P.], seq 1722:1948, ack 453, win 123, length 226
02:52:22.994071 IP 72.14.213.147.443 > 192.168.3.131.52152: Flags [P.], seq 1948:1993, ack 453, win 123, length 45
02:52:22.994072 IP 72.14.213.147.443 > 192.168.3.131.52152: Flags [.], ack 2279, win 213, length 0
02:52:22.994110 IP 192.168.3.131.52152 > 72.14.213.147.443: Flags [.], ack 1993, win 16377, length 0
02:52:23.103559 IP 192.168.3.131.55953 > 65.55.206.209.80: Flags [S], seq 2940642208, win 8192, options [mss 1460,nop,wscale 2,nop,nop,sackOK], length 0
02:52:23.134962 IP 72.14.213.147.443 > 192.168.3.131.52152: Flags [P.], seq 1993:2379, ack 2279, win 213, length 386
02:52:23.135841 IP 72.14.213.147.443 > 192.168.3.131.52152: Flags [.], seq 2379:3809, ack 2279, win 213, length 1430
02:52:23.135843 IP 72.14.213.147.443 > 192.168.3.131.52152: Flags [P.], seq 3809:3855, ack 2279, win 213, length 46
02:52:23.135887 IP 192.168.3.131.52152 > 72.14.213.147.443: Flags [.], ack 3855, win 16445, length 0
02:52:23.137376 IP 72.14.213.147.443 > 192.168.3.131.52152: Flags [.], seq 3855:5285, ack 2279, win 213, length 1430
02:52:23.137378 IP 72.14.213.147.443 > 192.168.3.131.52152: Flags [P.], seq 5285:6316, ack 2279, win 213, length 1031
02:52:23.137428 IP 192.168.3.131.52152 > 72.14.213.147.443: Flags [.], ack 6316, win 16445, length 0
02:52:23.163583 IP 72.14.213.147.443 > 192.168.3.131.52152: Flags [.], seq 6316:7746, ack 2279, win 213, length 1430
02:52:23.163586 IP 72.14.213.147.443 > 192.168.3.131.52152: Flags [P.], seq 7746:7792, ack 2279, win 213, length 46
02:52:23.163645 IP 192.168.3.131.52152 > 72.14.213.147.443: Flags [.], ack 7792, win 16445, length 0
02:52:23.164402 IP 72.14.213.147.443 > 192.168.3.131.52152: Flags [.], seq 7792:9222, ack 2279, win 213, length 1430
02:52:23.164403 IP 72.14.213.147.443 > 192.168.3.131.52152: Flags [P.], seq 9222:9852, ack 2279, win 213, length 630
02:52:23.164426 IP 192.168.3.131.52152 > 72.14.213.147.443: Flags [.], ack 9852, win 16445, length 0
02:52:23.168321 IP 72.14.213.147.443 > 192.168.3.131.52152: Flags [.], seq 9852:11282, ack 2279, win 213, length 1430
02:52:23.169073 IP 72.14.213.147.443 > 192.168.3.131.52152: Flags [.], seq 11282:12712, ack 2279, win 213, length 1430
02:52:23.169074 IP 72.14.213.147.443 > 192.168.3.131.52152: Flags [P.], seq 12712:12856, ack 2279, win 213, length 144
02:52:23.169106 IP 192.168.3.131.52152 > 72.14.213.147.443: Flags [.], ack 12856, win 16445, length 0
02:52:23.169874 IP 72.14.213.147.443 > 192.168.3.131.52152: Flags [P.], seq 12856:13665, ack 2279, win 213, length 809
02:52:23.182327 IP 65.55.206.209.80 > 192.168.3.131.55953: Flags [S.], seq 828418081, ack 2940642209, win 8190, options [mss 1460], length 0
02:52:23.182400 IP 192.168.3.131.55953 > 65.55.206.209.80: Flags [.], ack 1, win 64240, length 0
02:52:23.182793 IP 192.168.3.131.55953 > 65.55.206.209.80: Flags [P.], seq 1:462, ack 1, win 64240, length 461: HTTP: GET / HTTP/1.1
02:52:23.194040 IP 192.168.3.131.52152 > 72.14.213.147.443: Flags [P.], seq 2279:2528, ack 13665, win 16242, length 249
02:52:23.210582 IP 72.14.213.147.443 > 192.168.3.131.52152: Flags [.], seq 13665:15095, ack 2279, win 213, length 1430
02:52:23.211397 IP 72.14.213.147.443 > 192.168.3.131.52152: Flags [.], seq 15095:16525, ack 2279, win 213, length 1430
02:52:23.211398 IP 72.14.213.147.443 > 192.168.3.131.52152: Flags [P.], seq 16525:16644, ack 2279, win 213, length 119
02:52:23.211442 IP 192.168.3.131.52152 > 72.14.213.147.443: Flags [.], ack 16644, win 16445, length 0
02:52:23.212214 IP 72.14.213.147.443 > 192.168.3.131.52152: Flags [.], seq 16644:18074, ack 2279, win 213, length 1430
02:52:23.212977 IP 72.14.213.147.443 > 192.168.3.131.52152: Flags [.], seq 18074:19504, ack 2279, win 213, length 1430
02:52:23.212997 IP 192.168.3.131.52152 > 72.14.213.147.443: Flags [.], ack 19504, win 16445, length 0
02:52:23.213739 IP 72.14.213.147.443 > 192.168.3.131.52152: Flags [P.], seq 19504:20841, ack 2279, win 213, length 1337
02:52:23.213742 IP 72.14.213.147.443 > 192.168.3.131.52152: Flags [.], seq 20841:22271, ack 2279, win 213, length 1430
02:52:23.213743 IP 72.14.213.147.443 > 192.168.3.131.52152: Flags [.], seq 22271:23701, ack 2279, win 213, length 1430
02:52:23.213744 IP 72.14.213.147.443 > 192.168.3.131.52152: Flags [P.], seq 23701:23778, ack 2279, win 213, length 77
02:52:23.213785 IP 192.168.3.131.52152 > 72.14.213.147.443: Flags [.], ack 23778, win 16445, length 0
02:52:23.214528 IP 72.14.213.147.443 > 192.168.3.131.52152: Flags [P.], seq 23778:25022, ack 2279, win 213, length 1244
02:52:23.217804 IP 72.14.213.147.443 > 192.168.3.131.52152: Flags [P.], seq 25022:25103, ack 2528, win 257, length 81
02:52:23.217852 IP 192.168.3.131.52152 > 72.14.213.147.443: Flags [.], ack 25103, win 16113, length 0
02:52:23.231792 IP 72.14.213.147.443 > 192.168.3.131.52152: Flags [P.], seq 25103:25136, ack 2528, win 257, length 33
02:52:23.265531 IP 192.168.3.131.57011 > 72.14.213.138.80: Flags [P.], seq 943:1888, ack 387, win 16192, length 945: HTTP: GET /complete/search?client=chrome&hl=en-US&q=crai HTTP/1.1
02:52:23.266979 IP 65.55.206.209.80 > 192.168.3.131.55953: Flags [P.], seq 1:297, ack 462, win 65535, length 296: HTTP: HTTP/1.1 301 Moved Permanently
02:52:23.300298 IP 72.14.213.138.80 > 192.168.3.131.57011: Flags [P.], seq 387:856, ack 1888, win 980, length 469: HTTP: HTTP/1.1 200 OK
02:52:23.304502 IP 72.14.213.147.443 > 192.168.3.131.52152: Flags [.], ack 4468, win 347, length 0
02:52:23.337241 IP 192.168.3.131.55954 > 65.55.17.37.80: Flags [S], seq 3593671793, win 8192, options [mss 1460,nop,wscale 2,nop,nop,sackOK], length 0
02:52:23.343215 IP 72.14.213.147.443 > 192.168.3.131.52152: Flags [.], ack 6494, win 436, length 0
02:52:23.353712 IP 65.55.17.37.80 > 192.168.3.131.55954: Flags [S.], seq 443432526, ack 3593671794, win 8190, options [mss 1460], length 0
02:52:23.353773 IP 192.168.3.131.55954 > 65.55.17.37.80: Flags [.], ack 1, win 64240, length 0
02:52:23.354015 IP 192.168.3.131.55954 > 65.55.17.37.80: Flags [P.], seq 1:600, ack 1, win 64240, length 599: HTTP: GET / HTTP/1.1
02:52:23.387905 IP 65.55.17.37.80 > 192.168.3.131.55954: Flags [.], seq 1:1461, ack 600, win 8190, length 1460: HTTP: HTTP/1.1 200 OK
02:52:23.388697 IP 65.55.17.37.80 > 192.168.3.131.55954: Flags [.], seq 1461:2921, ack 600, win 8190, length 1460: HTTP
02:52:23.388719 IP 192.168.3.131.55954 > 65.55.17.37.80: Flags [.], ack 2921, win 64240, length 0
02:52:23.389466 IP 65.55.17.37.80 > 192.168.3.131.55954: Flags [.], seq 2921:4381, ack 600, win 8190, length 1460: HTTP
02:52:23.389469 IP 65.55.17.37.80 > 192.168.3.131.55954: Flags [.], seq 4381:5841, ack 600, win 8190, length 1460: HTTP
02:52:23.389497 IP 192.168.3.131.55954 > 65.55.17.37.80: Flags [.], ack 5841, win 64240, length 0
02:52:23.406847 IP 65.55.17.37.80 > 192.168.3.131.55954: Flags [.], seq 5841:7301, ack 600, win 8190, length 1460: HTTP
02:52:23.407631 IP 65.55.17.37.80 > 192.168.3.131.55954: Flags [.], seq 7301:8761, ack 600, win 8190, length 1460: HTTP
02:52:23.407632 IP 65.55.17.37.80 > 192.168.3.131.55954: Flags [.], seq 8761:10221, ack 600, win 8190, length 1460: HTTP
02:52:23.407660 IP 192.168.3.131.55954 > 65.55.17.37.80: Flags [.], ack 10221, win 64240, length 0
02:52:23.408415 IP 65.55.17.37.80 > 192.168.3.131.55954: Flags [.], seq 10221:11681, ack 600, win 8190, length 1460: HTTP
02:52:23.409163 IP 65.55.17.37.80 > 192.168.3.131.55954: Flags [.], seq 11681:13141, ack 600, win 8190, length 1460: HTTP
02:52:23.409181 IP 192.168.3.131.55954 > 65.55.17.37.80: Flags [.], ack 13141, win 64240, length 0
02:52:23.409919 IP 65.55.17.37.80 > 192.168.3.131.55954: Flags [P.], seq 13141:14601, ack 600, win 8190, length 1460: HTTP
02:52:23.409920 IP 65.55.17.37.80 > 192.168.3.131.55954: Flags [.], seq 14601:16061, ack 600, win 8190, length 1460: HTTP
02:52:23.409921 IP 65.55.17.37.80 > 192.168.3.131.55954: Flags [.], seq 16061:17521, ack 600, win 8190, length 1460: HTTP
02:52:23.409951 IP 192.168.3.131.55954 > 65.55.17.37.80: Flags [.], ack 17521, win 64240, length 0
02:52:23.427852 IP 65.55.17.37.80 > 192.168.3.131.55954: Flags [.], seq 17521:18981, ack 600, win 8190, length 1460: HTTP
02:52:23.428652 IP 65.55.17.37.80 > 192.168.3.131.55954: Flags [.], seq 18981:20441, ack 600, win 8190, length 1460: HTTP
02:52:23.428654 IP 65.55.17.37.80 > 192.168.3.131.55954: Flags [.], seq 20441:21901, ack 600, win 8190, length 1460: HTTP
02:52:23.428658 IP 65.55.17.37.80 > 192.168.3.131.55954: Flags [P.], seq 21901:23302, ack 600, win 8190, length 1401: HTTP
02:52:23.428743 IP 192.168.3.131.55954 > 65.55.17.37.80: Flags [.], ack 23302, win 64240, length 0
02:52:23.432182 IP 72.14.213.147.443 > 192.168.3.131.52152: Flags [P.], seq 25136:25214, ack 6494, win 436, length 78
02:52:23.433136 IP 72.14.213.147.443 > 192.168.3.131.52152: Flags [P.], seq 25214:26529, ack 6494, win 436, length 1315
02:52:23.433166 IP 192.168.3.131.52152 > 72.14.213.147.443: Flags [.], ack 26529, win 16445, length 0
02:52:23.461968 IP 192.168.3.131.55955 > 207.46.148.38.80: Flags [S], seq 690488054, win 8192, options [mss 1460,nop,wscale 2,nop,nop,sackOK], length 0
02:52:23.466591 IP 192.168.3.131.55953 > 65.55.206.209.80: Flags [.], ack 297, win 63944, length 0
02:52:23.472397 IP 72.14.213.147.443 > 192.168.3.131.52152: Flags [P.], seq 26529:26588, ack 6494, win 436, length 59
02:52:23.473189 IP 72.14.213.147.443 > 192.168.3.131.52152: Flags [P.], seq 26588:27379, ack 6494, win 436, length 791
02:52:23.473215 IP 192.168.3.131.52152 > 72.14.213.147.443: Flags [.], ack 27379, win 16232, length 0
02:52:23.474315 IP 207.46.148.38.80 > 192.168.3.131.55955: Flags [S.], seq 3974155008, ack 690488055, win 8192, options [mss 1460,nop,nop,sackOK], length 0
02:52:23.474367 IP 192.168.3.131.55955 > 207.46.148.38.80: Flags [.], ack 1, win 64240, length 0
02:52:23.474636 IP 192.168.3.131.55955 > 207.46.148.38.80: Flags [P.], seq 1:449, ack 1, win 64240, length 448: HTTP: GET /action/MMN_Homepage HTTP/1.1
02:52:23.490091 IP 207.46.148.38.80 > 192.168.3.131.55955: Flags [FP.], seq 1:280, ack 449, win 64240, length 279: HTTP: HTTP/1.1 200 OK
02:52:23.490168 IP 192.168.3.131.55955 > 207.46.148.38.80: Flags [.], ack 281, win 63961, length 0
02:52:23.490588 IP 192.168.3.131.55955 > 207.46.148.38.80: Flags [F.], seq 449, ack 281, win 63961, length 0
02:52:23.495065 IP 192.168.3.131.55956 > 66.235.139.121.80: Flags [S], seq 1815278486, win 8192, options [mss 1460,nop,wscale 2,nop,nop,sackOK], length 0
02:52:23.499908 IP 192.168.3.131.57011 > 72.14.213.138.80: Flags [.], ack 856, win 16445, length 0
02:52:23.511572 IP 192.168.3.131.52152 > 72.14.213.147.443: Flags [P.], seq 8378:8444, ack 27379, win 16232, length 66
02:52:23.515606 IP 207.46.148.38.80 > 192.168.3.131.55955: Flags [.], ack 450, win 64240, length 0
02:52:23.517728 IP 192.168.3.131.55957 > 65.55.5.232.80: Flags [S], seq 2391001289, win 8192, options [mss 1460,nop,wscale 2,nop,nop,sackOK], length 0
02:52:23.518271 IP 192.168.3.131.55958 > 65.55.239.163.80: Flags [S], seq 1749696983, win 8192, options [mss 1460,nop,wscale 2,nop,nop,sackOK], length 0
02:52:23.527584 IP 66.235.139.121.80 > 192.168.3.131.55956: Flags [S.], seq 3948468093, ack 1815278487, win 4380, options [mss 1460,nop,wscale 0,sackOK,eol], length 0
02:52:23.527648 IP 192.168.3.131.55956 > 66.235.139.121.80: Flags [.], ack 1, win 16425, length 0
02:52:23.528088 IP 192.168.3.131.55956 > 66.235.139.121.80: Flags [P.], seq 1:1054, ack 1, win 16425, length 1053: HTTP: GET /b/ss/msnportalhomepagecaen/1/H.7-pdv-2/s84495919100008?[AQB]&ndh=1&t=25%2F0%2F2011%2010%3A52%3A23%202%20480&ns=msnportal&pageName=MSN%20CanadaMSFTW&g=http%3A%2F%2Fca.msn.com%2F&r=&s=1680x1050&c=32&k=Y&bw=1680&bh=949&hp=N&ch=&server=msn.com&c1=Portal&v1=1%2F2011&c2=en-ca&v2=1%2F25%2F2011&c3=12.0&c19=Dblu%2CW1%2CQ1%2C4.0&c22=True&c29=http%3A%2F%2Fca.msn.com%2F&c4=&cc=USD&ct=lan&v=Y&j=1.3&[AQE] HTTP/1.1
02:52:23.532105 IP 72.14.213.147.443 > 192.168.3.131.52152: Flags [.], ack 8378, win 526, length 0
02:52:23.535669 IP 192.168.3.131.52152 > 72.14.213.147.443: Flags [P.], seq 8444:8699, ack 27379, win 16232, length 255
02:52:23.535758 IP 65.55.5.232.80 > 192.168.3.131.55957: Flags [S.], seq 3981672661, ack 2391001290, win 8190, options [mss 1460], length 0
02:52:23.535820 IP 192.168.3.131.55957 > 65.55.5.232.80: Flags [.], ack 1, win 64240, length 0
02:52:23.536159 IP 192.168.3.131.55957 > 65.55.5.232.80: Flags [P.], seq 1:648, ack 1, win 64240, length 647: HTTP: GET /ADSAdClient31.dll?GetSAd=&DPJS=0&PN=MSFT&PG=CAE9TX&AP=1389 HTTP/1.1
02:52:23.554357 IP 72.14.213.147.443 > 192.168.3.131.52152: Flags [.], ack 8699, win 570, length 0
02:52:23.555705 IP 65.55.5.232.80 > 192.168.3.131.55957: Flags [P.], seq 1:1013, ack 648, win 8190, length 1012: HTTP: HTTP/1.1 200 OK
02:52:23.564636 IP 66.235.139.121.80 > 192.168.3.131.55956: Flags [P.], seq 1:681, ack 1054, win 5433, length 680: HTTP: HTTP/1.1 302 Found
02:52:23.597302 IP 65.55.239.163.80 > 192.168.3.131.55958: Flags [S.], seq 1741890931, ack 1749696984, win 8190, options [mss 1460], length 0
02:52:23.597359 IP 192.168.3.131.55958 > 65.55.239.163.80: Flags [.], ack 1, win 64240, length 0
02:52:23.597709 IP 192.168.3.131.55958 > 65.55.239.163.80: Flags [P.], seq 1:579, ack 1, win 64240, length 578: HTTP: GET /c.gif?di=210&pi=11654&ps=10274&tp=http://ca.msn.com/ca.msn.com/default.aspxW&rf= HTTP/1.1
02:52:23.598332 IP 72.14.213.147.443 > 192.168.3.131.52152: Flags [P.], seq 27379:27501, ack 8699, win 570, length 122
02:52:23.599119 IP 72.14.213.147.443 > 192.168.3.131.52152: Flags [P.], seq 27501:27534, ack 8699, win 570, length 33
02:52:23.599139 IP 192.168.3.131.52152 > 72.14.213.147.443: Flags [.], ack 27534, win 16193, length 0
02:52:23.602774 IP 192.168.3.131.55959 > 65.55.5.231.80: Flags [S], seq 892852360, win 8192, options [mss 1460,nop,wscale 2,nop,nop,sackOK], length 0
02:52:23.620304 IP 65.55.5.231.80 > 192.168.3.131.55959: Flags [S.], seq 611666840, ack 892852361, win 8190, options [mss 1460], length 0
02:52:23.620358 IP 192.168.3.131.55959 > 65.55.5.231.80: Flags [.], ack 1, win 64240, length 0
02:52:23.620741 IP 192.168.3.131.55959 > 65.55.5.231.80: Flags [P.], seq 1:650, ack 1, win 64240, length 649: HTTP: GET /ADSAdClient31.dll?GetSAd=&DPJS=0&PN=MSFT&PG=CAE9UT&AP=1440 HTTP/1.1
02:52:23.640153 IP 65.55.5.231.80 > 192.168.3.131.55959: Flags [P.], seq 1:1013, ack 650, win 8190, length 1012: HTTP: HTTP/1.1 200 OK
02:52:23.645351 IP 72.14.213.147.443 > 192.168.3.131.52152: Flags [P.], seq 27534:27590, ack 8699, win 570, length 56
02:52:23.646149 IP 72.14.213.147.443 > 192.168.3.131.52152: Flags [P.], seq 27590:28050, ack 8699, win 570, length 460
02:52:23.646195 IP 192.168.3.131.52152 > 72.14.213.147.443: Flags [.], ack 28050, win 16445, length 0
02:52:23.652521 IP 192.168.3.131.55960 > 206.108.207.139.80: Flags [S], seq 2585327780, win 8192, options [mss 1460,nop,wscale 2,nop,nop,sackOK], length 0
02:52:23.659415 IP 192.168.3.131.55961 > 184.24.133.32.80: Flags [S], seq 690534209, win 8192, options [mss 1460,nop,wscale 2,nop,nop,sackOK], length 0
02:52:23.662230 IP 206.108.207.139.80 > 192.168.3.131.55960: Flags [S.], seq 2754106271, ack 2585327781, win 5840, options [mss 1460,nop,nop,sackOK,nop,wscale 5], length 0
02:52:23.662287 IP 192.168.3.131.55960 > 206.108.207.139.80: Flags [.], ack 1, win 16425, length 0
02:52:23.662628 IP 192.168.3.131.55960 > 206.108.207.139.80: Flags [P.], seq 1:512, ack 1, win 16425, length 511: HTTP: GET /r?c2=3000001&d.c=gif&d.o=msnportalhomepagecaen&d.x=184063711&d.t=page&d.u=http%3A%2F%2Fca.msn.com%2F HTTP/1.1
02:52:23.671725 IP 206.108.207.139.80 > 192.168.3.131.55960: Flags [.], ack 512, win 216, length 0
02:52:23.672502 IP 206.108.207.139.80 > 192.168.3.131.55960: Flags [P.], seq 1:523, ack 512, win 216, length 522: HTTP: HTTP/1.1 200 OK
02:52:23.673323 IP 184.24.133.32.80 > 192.168.3.131.55961: Flags [S.], seq 3519670384, ack 690534210, win 5840, options [mss 1460,nop,nop,sackOK,nop,wscale 5], length 0
02:52:23.673370 IP 192.168.3.131.55961 > 184.24.133.32.80: Flags [.], ack 1, win 16425, length 0
02:52:23.675076 IP 192.168.3.131.55961 > 184.24.133.32.80: Flags [P.], seq 1:705, ack 1, win 16425, length 704: HTTP: GET /scripts/beacon.dll?c1=2&c2=2128&c3=&c4=&c5=&c6=&c7=http%3A//ca.msn.com/&c8=MSN%20Canada%20-%20The%20home%20of%20world-class%20services%20such%20as%20Hotmail%2C%20Windows%20Live%20Messenger%2C%20and%20News%2C%20Sports%2C%20Financial%20and%20Entertainment&c9=&c10=1680x1050&rn=1295981543432 HTTP/1.1
02:52:23.677739 IP 65.55.239.163.80 > 192.168.3.131.55958: Flags [P.], seq 1:412, ack 579, win 64240, length 411: HTTP: HTTP/1.1 200 OK
02:52:23.687219 IP 184.24.133.32.80 > 192.168.3.131.55961: Flags [.], ack 705, win 227, length 0
02:52:23.688280 IP 184.24.133.32.80 > 192.168.3.131.55961: Flags [P.], seq 1:523, ack 705, win 227, length 522: HTTP: HTTP/1.1 200 OK
02:52:23.754726 IP 192.168.3.131.55962 > 65.55.5.232.80: Flags [S], seq 3252522747, win 8192, options [mss 1460,nop,wscale 2,nop,nop,sackOK], length 0
02:52:23.761593 IP 192.168.3.131.55957 > 65.55.5.232.80: Flags [.], ack 1013, win 63228, length 0
02:52:23.762574 IP 192.168.3.131.55956 > 66.235.139.121.80: Flags [.], ack 681, win 16255, length 0
02:52:23.772613 IP 65.55.5.232.80 > 192.168.3.131.55962: Flags [S.], seq 3767990281, ack 3252522748, win 8190, options [mss 1460], length 0
02:52:23.772673 IP 192.168.3.131.55962 > 65.55.5.232.80: Flags [.], ack 1, win 64240, length 0
02:52:23.772862 IP 192.168.3.131.55962 > 65.55.5.232.80: Flags [P.], seq 1:650, ack 1, win 64240, length 649: HTTP: GET /ADSAdClient31.dll?GetSAd=&DPJS=0&PN=MSFT&PG=CAEREC&AP=1089 HTTP/1.1
02:52:23.793356 IP 65.55.5.232.80 > 192.168.3.131.55962: Flags [P.], seq 1:1307, ack 650, win 8190, length 1306: HTTP: HTTP/1.1 200 OK
02:52:23.832607 IP 192.168.3.131.55959 > 65.55.5.231.80: Flags [.], ack 1013, win 63228, length 0
02:52:23.841133 IP 192.168.3.131.55963 > 65.54.95.140.80: Flags [S], seq 3435842502, win 8192, options [mss 1460,nop,wscale 2,nop,nop,sackOK], length 0
02:52:23.853616 IP 65.54.95.140.80 > 192.168.3.131.55963: Flags [S.], seq 751188073, ack 3435842503, win 65535, options [mss 1460,nop,wscale 4,sackOK,eol], length 0
02:52:23.853665 IP 192.168.3.131.55963 > 65.54.95.140.80: Flags [.], ack 1, win 16425, length 0
02:52:23.853844 IP 192.168.3.131.55963 > 65.54.95.140.80: Flags [P.], seq 1:398, ack 1, win 16425, length 397: HTTP: GET /i/94/9BE085B9BAD824CEB7C33F498354B.jpg HTTP/1.1
02:52:23.867619 IP 65.54.95.140.80 > 192.168.3.131.55963: Flags [.], seq 1:1461, ack 398, win 4106, length 1460: HTTP: HTTP/1.1 200 OK
02:52:23.868425 IP 65.54.95.140.80 > 192.168.3.131.55963: Flags [.], seq 1461:2921, ack 398, win 4106, length 1460: HTTP
02:52:23.868446 IP 192.168.3.131.55963 > 65.54.95.140.80: Flags [.], ack 2921, win 16425, length 0
02:52:23.874614 IP 192.168.3.131.55958 > 65.55.239.163.80: Flags [.], ack 412, win 63829, length 0
02:52:23.881606 IP 192.168.3.131.55960 > 206.108.207.139.80: Flags [.], ack 523, win 16294, length 0
02:52:23.881989 IP 65.54.95.140.80 > 192.168.3.131.55963: Flags [P.], seq 2921:3240, ack 398, win 4106, length 319: HTTP
02:52:23.890590 IP 192.168.3.131.55961 > 184.24.133.32.80: Flags [.], ack 523, win 16294, length 0
02:52:23.981324 IP 192.168.3.131.55966 > 63.215.202.48.80: Flags [S], seq 1727752037, win 8192, options [mss 1460,nop,wscale 2,nop,nop,sackOK], length 0
02:52:23.998656 IP 192.168.3.131.55962 > 65.55.5.232.80: Flags [.], ack 1307, win 62934, length 0
02:52:24.052557 IP 63.215.202.48.80 > 192.168.3.131.55966: Flags [S.], seq 1157234095, ack 1727752038, win 8190, options [mss 1460], length 0
02:52:24.052689 IP 192.168.3.131.55966 > 63.215.202.48.80: Flags [.], ack 1, win 64240, length 0
02:52:24.053188 IP 192.168.3.131.55966 > 63.215.202.48.80: Flags [P.], seq 1:516, ack 1, win 64240, length 515: HTTP: GET /ad/js/12308-120034-30721-0?mpt=[1627390274ER]&mpvc= HTTP/1.1
02:52:24.090635 IP 192.168.3.131.55963 > 65.54.95.140.80: Flags [.], ack 3240, win 16345, length 0
02:52:24.125059 IP 63.215.202.48.80 > 192.168.3.131.55966: Flags [P.], seq 1:625, ack 516, win 32767, length 624: HTTP: HTTP/1.1 302 Moved Temporarily
02:52:24.198549 IP 192.168.3.131.57011 > 72.14.213.138.80: Flags [P.], seq 1888:2839, ack 856, win 16445, length 951: HTTP: GET /complete/search?client=chrome&hl=en-US&q=craigslist HTTP/1.1
02:52:24.232473 IP 72.14.213.138.80 > 192.168.3.131.57011: Flags [P.], seq 856:1335, ack 2839, win 1002, length 479: HTTP: HTTP/1.1 200 OK
02:52:24.252538 IP 192.168.3.131.55967 > 63.215.202.49.80: Flags [S], seq 3777314013, win 8192, options [mss 1460,nop,wscale 2,nop,nop,sackOK], length 0
02:52:24.320806 IP 63.215.202.49.80 > 192.168.3.131.55967: Flags [S.], seq 3932680054, ack 3777314014, win 8190, options [mss 1460], length 0
02:52:24.320865 IP 192.168.3.131.55967 > 63.215.202.49.80: Flags [.], ack 1, win 64240, length 0
02:52:24.321236 IP 192.168.3.131.55967 > 63.215.202.49.80: Flags [P.], seq 1:641, ack 1, win 64240, length 640: HTTP: GET /content/0/12308/120034/1326513_300x250_new_year_v130_trend_en_c02.js?mpck=altfarm.mediaplex.com%2Fad%2Fck%2F12308-120034-30721-0%3Fmpt%3D%5B1627390274ER%5D&mpt=[1627390274ER]&mpvc= HTTP/1.1
02:52:24.330674 IP 192.168.3.131.55966 > 63.215.202.48.80: Flags [.], ack 625, win 63616, length 0
02:52:24.392298 IP 63.215.202.49.80 > 192.168.3.131.55967: Flags [.], seq 1:1461, ack 641, win 16380, length 1460: HTTP: HTTP/1.1 200 OK
02:52:24.393105 IP 63.215.202.49.80 > 192.168.3.131.55967: Flags [.], seq 1461:2921, ack 641, win 16380, length 1460: HTTP
02:52:24.393106 IP 63.215.202.49.80 > 192.168.3.131.55967: Flags [P.], seq 2921:4203, ack 641, win 16380, length 1282: HTTP
02:52:24.393150 IP 192.168.3.131.55967 > 63.215.202.49.80: Flags [.], ack 4203, win 64240, length 0
02:52:24.430050 IP 192.168.3.131.55957 > 65.55.5.232.80: Flags [P.], seq 648:1295, ack 1013, win 63228, length 647: HTTP: GET /ADSAdClient31.dll?GetSAd=&DPJS=0&PN=MSFT&PG=CAIPBB&AP=1455 HTTP/1.1
02:52:24.437888 IP 192.168.3.131.57011 > 72.14.213.138.80: Flags [.], ack 1335, win 16325, length 0
02:52:24.449354 IP 65.55.5.232.80 > 192.168.3.131.55957: Flags [P.], seq 1013:1890, ack 1295, win 8190, length 877: HTTP: HTTP/1.1 200 OK
02:52:24.648681 IP 192.168.3.131.55957 > 65.55.5.232.80: Flags [.], ack 1890, win 64240, length 0
02:52:25.001246 IP 192.168.3.131.55968 > 72.14.213.101.80: Flags [S], seq 3544462254, win 8192, options [mss 1460,nop,wscale 2,nop,nop,sackOK], length 0
02:52:25.020411 IP 72.14.213.101.80 > 192.168.3.131.55968: Flags [S.], seq 3699617855, ack 3544462255, win 5720, options [mss 1430,nop,nop,sackOK,nop,wscale 6], length 0
02:52:25.020471 IP 192.168.3.131.55968 > 72.14.213.101.80: Flags [.], ack 1, win 16445, length 0
02:52:25.020753 IP 192.168.3.131.55968 > 72.14.213.101.80: Flags [P.], seq 1:1370, ack 1, win 16445, length 1369: HTTP: POST /tbproxy/af/query HTTP/1.1
02:52:25.020779 IP 192.168.3.131.55968 > 72.14.213.101.80: Flags [P.], seq 1370:1649, ack 1, win 16445, length 279: HTTP
02:52:25.040993 IP 72.14.213.101.80 > 192.168.3.131.55968: Flags [.], ack 1370, win 133, length 0
02:52:25.041761 IP 72.14.213.101.80 > 192.168.3.131.55968: Flags [.], ack 1649, win 175, length 0
02:52:25.041891 IP 192.168.3.131.55971 > 65.55.17.37.80: Flags [S], seq 3020697970, win 8192, options [mss 1460,nop,wscale 2,nop,nop,sackOK], length 0
02:52:25.042293 IP 192.168.3.131.55954 > 65.55.17.37.80: Flags [P.], seq 600:1186, ack 23302, win 64240, length 586: HTTP: GET /ajax/Horoscope.aspx?zodiacsign=ari&lcid=en-ca HTTP/1.1
02:52:25.044034 IP 72.14.213.101.80 > 192.168.3.131.55968: Flags [P.], seq 1:303, ack 1649, win 175, length 302: HTTP: HTTP/1.1 200 OK
02:52:25.044729 IP 192.168.3.131.57839 > 72.14.213.147.80: Flags [P.], seq 1231352759:1231353839, ack 666560743, win 16088, length 1080: HTTP: GET /search?aq=f&sourceid=chrome&ie=UTF-8&q=craigslist+kelowna HTTP/1.1
02:52:25.059842 IP 65.55.17.37.80 > 192.168.3.131.55971: Flags [S.], seq 1313892660, ack 3020697971, win 8190, options [mss 1460], length 0
02:52:25.059916 IP 192.168.3.131.55971 > 65.55.17.37.80: Flags [.], ack 1, win 64240, length 0
02:52:25.060849 IP 192.168.3.131.55971 > 65.55.17.37.80: Flags [P.], seq 1:553, ack 1, win 64240, length 552: HTTP: GET /ajax/I.aspx HTTP/1.1
02:52:25.062198 IP 65.55.17.37.80 > 192.168.3.131.55954: Flags [P.], seq 23302:24045, ack 1186, win 8190, length 743: HTTP: HTTP/1.1 200 OK
02:52:25.064161 IP 72.14.213.147.80 > 192.168.3.131.57839: Flags [.], ack 1080, win 1002, length 0
02:52:25.074585 IP 72.14.213.147.80 > 192.168.3.131.57839: Flags [P.], seq 1:1193, ack 1080, win 1002, length 1192: HTTP: HTTP/1.1 200 OK
02:52:25.075434 IP 72.14.213.147.80 > 192.168.3.131.57839: Flags [.], seq 1193:2623, ack 1080, win 1002, length 1430: HTTP
02:52:25.075436 IP 72.14.213.147.80 > 192.168.3.131.57839: Flags [.], seq 2623:4053, ack 1080, win 1002, length 1430: HTTP
02:52:25.075439 IP 72.14.213.147.80 > 192.168.3.131.57839: Flags [P.], seq 4053:4773, ack 1080, win 1002, length 720: HTTP
02:52:25.075504 IP 192.168.3.131.57839 > 72.14.213.147.80: Flags [.], ack 4773, win 16445, length 0
02:52:25.080981 IP 65.55.17.37.80 > 192.168.3.131.55971: Flags [P.], seq 1:856, ack 553, win 8190, length 855: HTTP: HTTP/1.1 200 OK
02:52:25.094681 IP 192.168.3.131.55954 > 65.55.17.37.80: Flags [P.], seq 1186:1838, ack 24045, win 63497, length 652: HTTP: GET /blank.aspx?1295981545068 HTTP/1.1
02:52:25.100731 IP 192.168.3.131.55954 > 65.55.17.37.80: Flags [F.], seq 1838, ack 24045, win 63497, length 0
02:52:25.113893 IP 65.55.17.37.80 > 192.168.3.131.55954: Flags [P.], seq 24045:24471, ack 1838, win 8190, length 426: HTTP: HTTP/1.1 200 OK
02:52:25.113959 IP 192.168.3.131.55954 > 65.55.17.37.80: Flags [R.], seq 1839, ack 24471, win 0, length 0
02:52:25.116126 IP 192.168.3.131.55963 > 65.54.95.140.80: Flags [P.], seq 398:796, ack 3240, win 16345, length 398: HTTP: GET /i/D6/8E763C825DC0E388929AE1B375CE18.JPG HTTP/1.1
02:52:25.127304 IP 192.168.3.131.55972 > 207.46.216.54.80: Flags [S], seq 4283028822, win 8192, options [mss 1460,nop,wscale 2,nop,nop,sackOK], length 0
02:52:25.127681 IP 192.168.3.131.55973 > 65.54.95.142.80: Flags [S], seq 3669471991, win 8192, options [mss 1460,nop,wscale 2,nop,nop,sackOK], length 0
02:52:25.127826 IP 192.168.3.131.55956 > 66.235.139.121.80: Flags [P.], seq 1054:2202, ack 681, win 16255, length 1148: HTTP: GET /b/ss/msnportalhomepagecaen/1/H.7-pdv-2/s81580283869989?[AQB]&ndh=1&t=25%2F0%2F2011%2010%3A52%3A23%202%20480&ns=msnportal&pageName=MSN%20CanadaMSFTW&g=http%3A%2F%2Fca.msn.com%2F&r=&s=1680x1050&c=32&k=Y&bw=1680&bh=949&hp=N&events=event4&c12=http%3A%2F%2Fca.msn.com%2F%23&c13=wrapper%3EticklerI&c15=1&c16=IEAKTickler%20Prompt%20shown&c17=MSN%20CanadaMSFTW%3AMSFT&c18=&c38=12.0&v12=http%3A%2F%2Fca.msn.com%2F%23&v11=IEAKTickler%20Prompt%20shown&pe=lnk_o&pev2=IEAKTickler%20Prompt%20shown&[AQE] HTTP/1.1
02:52:25.127922 IP 192.168.3.131.55971 > 65.55.17.37.80: Flags [P.], seq 553:1216, ack 856, win 63385, length 663: HTTP: GET /blank.aspx?1295981545103 HTTP/1.1
02:52:25.131007 IP 65.54.95.140.80 > 192.168.3.131.55963: Flags [P.], seq 3240:4311, ack 796, win 4106, length 1071: HTTP: HTTP/1.1 200 OK
02:52:25.140562 IP 207.46.216.54.80 > 192.168.3.131.55972: Flags [S.], seq 1831367140, ack 4283028823, win 8190, options [mss 1460], length 0
02:52:25.140621 IP 192.168.3.131.55972 > 207.46.216.54.80: Flags [.], ack 1, win 64240, length 0
02:52:25.140818 IP 192.168.3.131.55972 > 207.46.216.54.80: Flags [P.], seq 1:531, ack 1, win 64240, length 530: HTTP: GET /_0nwenca0/00/00?http://ca.msn.com/&&ps=10274&pi=11654&di=210&gt1=&ce=1&cm=wrapper%3EticklerI&hl=IEAKTickler%20Prompt%20shown&su=http%3A%2F%2Fca.msn.com%2Fca.msn.com%2Fdefault.aspxW HTTP/1.1
02:52:25.141378 IP 65.54.95.142.80 > 192.168.3.131.55973: Flags [S.], seq 2239560175, ack 3669471992, win 65535, options [mss 1460,nop,wscale 4,sackOK,eol], length 0
02:52:25.141403 IP 192.168.3.131.55973 > 65.54.95.142.80: Flags [.], ack 1, win 16425, length 0
02:52:25.141536 IP 192.168.3.131.55973 > 65.54.95.142.80: Flags [P.], seq 1:389, ack 1, win 16425, length 388: HTTP: GET /br/hp/11/i/en_ie8-tickler.jpg HTTP/1.1
02:52:25.150111 IP 65.55.17.37.80 > 192.168.3.131.55971: Flags [P.], seq 856:1282, ack 1216, win 8190, length 426: HTTP: HTTP/1.1 200 OK
02:52:25.153541 IP 207.46.216.54.80 > 192.168.3.131.55972: Flags [P.], seq 1:211, ack 531, win 64240, length 210: HTTP: HTTP/1.1 204 No Content
02:52:25.155769 IP 65.54.95.142.80 > 192.168.3.131.55973: Flags [.], seq 1:1461, ack 389, win 4106, length 1460: HTTP: HTTP/1.1 200 OK
02:52:25.156534 IP 65.54.95.142.80 > 192.168.3.131.55973: Flags [.], seq 1461:2921, ack 389, win 4106, length 1460: HTTP
02:52:25.156535 IP 65.54.95.142.80 > 192.168.3.131.55973: Flags [.], seq 2921:4381, ack 389, win 4106, length 1460: HTTP
02:52:25.156561 IP 192.168.3.131.55973 > 65.54.95.142.80: Flags [.], ack 4381, win 16425, length 0
02:52:25.163878 IP 66.235.139.121.80 > 192.168.3.131.55956: Flags [P.], seq 681:1258, ack 2202, win 6581, length 577: HTTP: HTTP/1.1 200 OK
02:52:25.169834 IP 72.14.213.147.80 > 192.168.3.131.57839: Flags [.], seq 4773:6203, ack 1080, win 1002, length 1430: HTTP
02:52:25.170684 IP 72.14.213.147.80 > 192.168.3.131.57839: Flags [.], seq 6203:7633, ack 1080, win 1002, length 1430: HTTP
02:52:25.170718 IP 192.168.3.131.57839 > 72.14.213.147.80: Flags [.], ack 7633, win 16445, length 0
02:52:25.171021 IP 65.54.95.142.80 > 192.168.3.131.55973: Flags [.], seq 4381:5841, ack 389, win 4106, length 1460: HTTP
02:52:25.171519 IP 72.14.213.147.80 > 192.168.3.131.57839: Flags [P.], seq 7633:8496, ack 1080, win 1002, length 863: HTTP
02:52:25.171811 IP 65.54.95.142.80 > 192.168.3.131.55973: Flags [.], seq 5841:7301, ack 389, win 4106, length 1460: HTTP
02:52:25.171836 IP 192.168.3.131.55973 > 65.54.95.142.80: Flags [.], ack 7301, win 16425, length 0
02:52:25.172586 IP 65.54.95.142.80 > 192.168.3.131.55973: Flags [.], seq 7301:8761, ack 389, win 4106, length 1460: HTTP
02:52:25.172587 IP 65.54.95.142.80 > 192.168.3.131.55973: Flags [.], seq 8761:10221, ack 389, win 4106, length 1460: HTTP
02:52:25.172610 IP 192.168.3.131.55973 > 65.54.95.142.80: Flags [.], ack 10221, win 16425, length 0
02:52:25.174141 IP 65.54.95.142.80 > 192.168.3.131.55973: Flags [.], seq 10221:11681, ack 389, win 4106, length 1460: HTTP
02:52:25.175504 IP 65.54.95.142.80 > 192.168.3.131.55973: Flags [.], seq 11681:13141, ack 389, win 4106, length 1460: HTTP
02:52:25.175533 IP 192.168.3.131.55973 > 65.54.95.142.80: Flags [.], ack 13141, win 16425, length 0
02:52:25.176053 IP 72.14.213.147.80 > 192.168.3.131.57839: Flags [P.], seq 8496:9843, ack 1080, win 1002, length 1347: HTTP
02:52:25.176118 IP 192.168.3.131.57839 > 72.14.213.147.80: Flags [.], ack 9843, win 16445, length 0
02:52:25.176273 IP 65.54.95.142.80 > 192.168.3.131.55973: Flags [.], seq 13141:14601, ack 389, win 4106, length 1460: HTTP
02:52:25.177028 IP 65.54.95.142.80 > 192.168.3.131.55973: Flags [.], seq 14601:16061, ack 389, win 4106, length 1460: HTTP
02:52:25.177046 IP 192.168.3.131.55973 > 65.54.95.142.80: Flags [.], ack 16061, win 16425, length 0
02:52:25.177787 IP 65.54.95.142.80 > 192.168.3.131.55973: Flags [.], seq 16061:17521, ack 389, win 4106, length 1460: HTTP
02:52:25.177788 IP 65.54.95.142.80 > 192.168.3.131.55973: Flags [.], seq 17521:18981, ack 389, win 4106, length 1460: HTTP
02:52:25.177813 IP 192.168.3.131.55973 > 65.54.95.142.80: Flags [.], ack 18981, win 16425, length 0
02:52:25.181259 IP 65.54.95.142.80 > 192.168.3.131.55973: Flags [.], seq 18981:20441, ack 389, win 4106, length 1460: HTTP
02:52:25.182251 IP 65.54.95.142.80 > 192.168.3.131.55973: Flags [.], seq 20441:21901, ack 389, win 4106, length 1460: HTTP
02:52:25.182278 IP 192.168.3.131.55973 > 65.54.95.142.80: Flags [.], ack 21901, win 16425, length 0
02:52:25.183027 IP 65.54.95.142.80 > 192.168.3.131.55973: Flags [.], seq 21901:23361, ack 389, win 4106, length 1460: HTTP
02:52:25.183030 IP 65.54.95.142.80 > 192.168.3.131.55973: Flags [.], seq 23361:24821, ack 389, win 4106, length 1460: HTTP
02:52:25.183058 IP 192.168.3.131.55973 > 65.54.95.142.80: Flags [.], ack 24821, win 16425, length 0
02:52:25.183805 IP 65.54.95.142.80 > 192.168.3.131.55973: Flags [.], seq 24821:26281, ack 389, win 4106, length 1460: HTTP
02:52:25.185499 IP 65.54.95.142.80 > 192.168.3.131.55973: Flags [.], seq 26281:27741, ack 389, win 4106, length 1460: HTTP
02:52:25.185520 IP 192.168.3.131.55973 > 65.54.95.142.80: Flags [.], ack 27741, win 16425, length 0
02:52:25.186263 IP 65.54.95.142.80 > 192.168.3.131.55973: Flags [.], seq 27741:29201, ack 389, win 4106, length 1460: HTTP
02:52:25.187021 IP 65.54.95.142.80 > 192.168.3.131.55973: Flags [.], seq 29201:30661, ack 389, win 4106, length 1460: HTTP
02:52:25.187048 IP 192.168.3.131.55973 > 65.54.95.142.80: Flags [.], ack 30661, win 16425, length 0
02:52:25.187789 IP 65.54.95.142.80 > 192.168.3.131.55973: Flags [.], seq 30661:32121, ack 389, win 4106, length 1460: HTTP
02:52:25.187790 IP 65.54.95.142.80 > 192.168.3.131.55973: Flags [P.], seq 32121:33205, ack 389, win 4106, length 1084: HTTP
02:52:25.187810 IP 192.168.3.131.55973 > 65.54.95.142.80: Flags [.], ack 33205, win 16425, length 0
02:52:25.246658 IP 192.168.3.131.55968 > 72.14.213.101.80: Flags [.], ack 303, win 16369, length 0
02:52:25.263005 IP 72.14.213.101.80 > 192.168.3.131.55968: Flags [P.], seq 1:303, ack 1649, win 175, length 302: HTTP: HTTP/1.1 200 OK
02:52:25.263039 IP 192.168.3.131.55968 > 72.14.213.101.80: Flags [.], ack 303, win 16369, options [nop,nop,sack 1 {1:303}], length 0
02:52:25.294571 IP 192.168.3.131.57839 > 72.14.213.147.80: Flags [P.], seq 1080:2292, ack 9843, win 16445, length 1212: HTTP: GET /csi?v=3&s=web&action=&srt=50&e=17259,18167,25907,27893,28186,28254&ei=Fh8_TfP6KITSsAP30anUBQ&expi=17259,18167,25907,27893,28186,28254&imc=3&imn=3&imp=0&rt=xjsls.114,prt.115,xjses.124,xjsee.166,xjs.184,ol.206,iml.115 HTTP/1.1
02:52:25.331714 IP 192.168.3.131.55963 > 65.54.95.140.80: Flags [.], ack 4311, win 16077, length 0
02:52:25.347736 IP 192.168.3.131.55971 > 65.55.17.37.80: Flags [.], ack 1282, win 62959, length 0
02:52:25.356450 IP 72.14.213.147.80 > 192.168.3.131.57839: Flags [.], ack 2292, win 1002, length 0
02:52:25.356727 IP 192.168.3.131.55972 > 207.46.216.54.80: Flags [.], ack 211, win 64030, length 0
02:52:25.360182 IP 72.14.213.147.80 > 192.168.3.131.57839: Flags [P.], seq 9843:10058, ack 2292, win 1002, length 215: HTTP: HTTP/1.1 204 No Content
02:52:25.366722 IP 192.168.3.131.55956 > 66.235.139.121.80: Flags [.], ack 1258, win 16110, length 0
02:52:25.563901 IP 192.168.3.131.57839 > 72.14.213.147.80: Flags [.], ack 10058, win 16391, length 0
02:52:26.504707 IP 192.168.3.131.57839 > 72.14.213.147.80: Flags [P.], seq 2292:3395, ack 10058, win 16391, length 1103: HTTP: GET /url?sa=T&source=web&cd=1&ved=0CBUQFjAA&url=http%3A%2F%2Fkelowna.craigslist.ca%2F&ei=Fh8_TfP6KITSsAP30anUBQ HTTP/1.1
02:52:26.525504 IP 72.14.213.147.80 > 192.168.3.131.57839: Flags [.], ack 3395, win 1002, length 0
02:52:26.532029 IP 72.14.213.147.80 > 192.168.3.131.57839: Flags [P.], seq 10058:10327, ack 3395, win 1002, length 269: HTTP: HTTP/1.1 204 No Content
02:52:26.609581 IP 192.168.3.131.58264 > 208.82.236.129.80: Flags [S], seq 3433831109, win 8192, options [mss 1460,nop,wscale 2,nop,nop,sackOK], length 0
02:52:26.634125 IP 192.168.3.131.55963 > 65.54.95.140.80: Flags [P.], seq 796:1194, ack 4311, win 16077, length 398: HTTP: GET /i/86/998863E64E6ED2A022EECB50A53CC3.jpg HTTP/1.1
02:52:26.648415 IP 65.54.95.140.80 > 192.168.3.131.55963: Flags [.], seq 4311:5771, ack 1194, win 4106, length 1460: HTTP: HTTP/1.1 200 OK
02:52:26.649213 IP 65.54.95.140.80 > 192.168.3.131.55963: Flags [.], seq 5771:7231, ack 1194, win 4106, length 1460: HTTP
02:52:26.649214 IP 65.54.95.140.80 > 192.168.3.131.55963: Flags [.], seq 7231:8691, ack 1194, win 4106, length 1460: HTTP
02:52:26.649266 IP 192.168.3.131.55963 > 65.54.95.140.80: Flags [.], ack 8691, win 16425, length 0
02:52:26.652613 IP 65.54.95.140.80 > 192.168.3.131.55963: Flags [.], seq 8691:10151, ack 1194, win 4106, length 1460: HTTP
02:52:26.653394 IP 65.54.95.140.80 > 192.168.3.131.55963: Flags [.], seq 10151:11611, ack 1194, win 4106, length 1460: HTTP
02:52:26.653396 IP 65.54.95.140.80 > 192.168.3.131.55963: Flags [P.], seq 11611:12580, ack 1194, win 4106, length 969: HTTP
02:52:26.653429 IP 192.168.3.131.55963 > 65.54.95.140.80: Flags [.], ack 12580, win 16425, length 0
02:52:26.660190 IP 208.82.236.129.80 > 192.168.3.131.58264: Flags [S.], seq 3453143087, ack 3433831110, win 4380, options [mss 1460,nop,wscale 0,sackOK,eol], length 0
02:52:26.660260 IP 192.168.3.131.58264 > 208.82.236.129.80: Flags [.], ack 1, win 16425, length 0
02:52:26.660658 IP 192.168.3.131.58264 > 208.82.236.129.80: Flags [P.], seq 1:554, ack 1, win 16425, length 553: HTTP: GET / HTTP/1.1
02:52:26.731760 IP 192.168.3.131.57839 > 72.14.213.147.80: Flags [.], ack 10327, win 16324, length 0
02:52:26.732629 IP 208.82.236.129.80 > 192.168.3.131.58264: Flags [P.], seq 1:217, ack 554, win 4933, length 216: HTTP: HTTP/1.1 302 Found
02:52:26.732630 IP 208.82.236.129.80 > 192.168.3.131.58264: Flags [F.], seq 217, ack 554, win 4933, length 0
02:52:26.732736 IP 192.168.3.131.58264 > 208.82.236.129.80: Flags [.], ack 218, win 16371, length 0
